DISTRICT,UPAJILA,EIIN,INSTITUTE_NAME,ADDRESS,POST,MOBAILE,MANAGEMENT,MPO
Comilla,Barura,105117,HAFIZ AHMED HIGH SCHOOL,EAKBARIA,EKABERIA,1819829452,PRIVATE,Yes
Comilla,Barura,105118,KRISHNA PUR HIGH SCHOOL,KRISHNA PUR,KOILAIN,1309105118,PRIVATE,Yes
Comilla,Barura,105119,SHAKPUR HIGH SCHOOL,SHAKPUR,SHAKPUR,1950605023,PRIVATE,Yes
Comilla,Barura,105120,SUDRA TAYAB ALI HIGH SCHOOL,SUDRA,SUDRA,1721558751,PRIVATE,Yes
Comilla,Barura,105121,POYAL GACHA TECHNICAL GIRLS HIGH SCHOOL,POYAL GOACHA,BARA HORIPUR,1818642945,PRIVATE,Yes
Comilla,Barura,105122,JOYNAGOR SCHEDUL CAST HIGH SCHOOL,JOYNAGAR,KADBA DEORA,1819196597,PRIVATE,Yes
Comilla,Barura,105123,ADDA UMEDIA HIGH SCHOOL,ADDA,ADDA BAZAR,1309105123,PRIVATE,Yes
Comilla,Barura,105124,BARHATUA HIGH SCHOOL,BARHATUA,KAMTALI,1872080800,PRIVATE,Yes
Comilla,Barura,105125,BARA KAYANI HIGH SCHOOL,BARA KAYANI,DANASHARI,1819692759,PRIVATE,Yes
Comilla,Barura,105126,SHARAFATI HIGH SCHOOL,SHARAFATI,SARAFATI,1819928395,PRIVATE,Yes
Comilla,Barura,105127,BARURA GOVT GIRLS HIGH SCHOOL,THANA ROAD BARURA,BARURA BAZER,1710801899,PUBLIC,No
Comilla,Barura,105128,BARURA HAJI NOWAB ALI PILOT HIGH SCHOOL,BARURA,BARURA BAZAR,1719852109,PRIVATE,Yes
Comilla,Barura,105129,GALIMPUR T.C. HIGH SCHOOL,GALIMPUR,GALIMPUR,1309105129,PRIVATE,Yes
Comilla,Barura,105130,KADABA TALAGRAM T.C LAHA HIGH SCHOOL,TALAGRAM,BARURA,1716059702,PRIVATE,Yes
Comilla,Barura,105131,BATAI CHARI HIGH SCHOOL,BARAHAGINA,BATAI SARI,1732313838,PRIVATE,Yes
Comilla,Barura,105132,PAYALGACHA MULTI. HGIH SCHOOL,PAYALGACHA,PAYALGACHA,1716527771,PRIVATE,Yes
Comilla,Barura,105133,HARIPUR AGANGAR HIGH SCHOOL,HARIPUR,BARA HARIPUR,1818647178,PRIVATE,Yes
Comilla,Barura,105134,AMRATALI C.ALI HIGH SCHOOL,AMRATALI,AMRATALI,1716642746,PRIVATE,Yes
Comilla,Barura,105135,PERPETY HIGH SCHOOL,PER PETI,PERPETI,1811160791,PRIVATE,Yes
Comilla,Barura,105136,CHOTA TULAGAON HIGH SCHOOL,CHHOTO TOLAGAON ,CHHOTO TOLAGAON,1818179489,PRIVATE,Yes
Comilla,Barura,105137,SHILMURI R.R. HIGH SCHOOL,SHILMURI,SHILMURI,1849967496,PRIVATE,Yes
Comilla,Barura,105138,SHASHAIYA D. M HIGH SCHOOL,SHASHAIYA,SHASHAIYA,1817064910,PRIVATE,Yes
Comilla,Barura,105139,JOUR PUKURIA HIGH SCHOOL,JOUR PUKORIA,DANISHWAR,1719723580,PRIVATE,Yes
Comilla,Barura,105140,GHOSPA C. F. U. C HIGH SCHOOL,GHOSHPA,SHILMORI,1710818316,PRIVATE,Yes
Comilla,Barura,105141,DEORA SECONDARY SCHOOL,DEORA,KADBA DEORA,1732785332,PRIVATE,Yes
Comilla,Barura,105142,SONAI MURI HIGH SCHOOL,SONAIMURI,SONAIMURI BAZAR,1712341780,PRIVATE,Yes
Comilla,Barura,105143,MOHESHPUR AZIZIA HIGH SCHOOL,MOHESHPUR,MOHESHPUR,1716279362,PRIVATE,Yes
Comilla,Barura,105144,PLIGIRI KHARUL HAZI ABBAS ALI ADDARSA HIGH SCHOOL,PILGIRI,CHOTO TULAGOAN,1817574169,PRIVATE,Yes
Comilla,Barura,105145,BHATASHWAR HIGH SCHOOL,BHATASHWAR,CHOTO TULAGOAN,1309105145,PRIVATE,Yes
Comilla,Barura,105146,NALUA MONAOHARPUR HIGH SCHOOL,NALUA,PERPETI,1309105146,PRIVATE,Yes
Comilla,Barura,105147,KEMTALI TECHNICAL HIGH SCHOOL,KEMTALI,KEMTALI,1716441448,PRIVATE,Yes
Comilla,Barura,105148,MOGGAON ADARSHA HIGH SCHOOL,MOGGAON,BHAUKSHER BAZAR,1615533365,PRIVATE,Yes
Comilla,Barura,105149,LAKSHMIPUR SHAHID SMRITE GIRLS HIGH SCHOOL,LAKSHMIPUR,MUDAFORGONJ,1721726238,PRIVATE,Yes
Comilla,Barura,105150,MAKUNDA PUR HIGH SCHOOL,MUKUNDA PUR,JHALAM  BAZAR,1768953385,PRIVATE,Yes
Comilla,Barura,105151,NARINDRAPUR NOADDA HIGH SCHOOL,NARINDRAPUR,EAKBARIA,1814824478,PRIVATE,Yes
Comilla,Barura,105152,DIMDUL ADORSHA HIGH SCHOOL,DIMDUL,DIMDOL,1817569332,PRIVATE,Yes
Comilla,Barura,105153,NALUA CHANDPUR HIGH  SCHOOL,NALUA CHAND PUR,NALUA CHANDPUR,1309105153,PRIVATE,Yes
Comilla,Barura,105154,AGANAGAR ABUL BASHIR TECHNICAL HIGH SCHOOL,AGANAGAR,BARO HARIPUR,1720107041,PRIVATE,Yes
Comilla,Barura,105155,MUGUZI MASTER SOBHAN HIGH SCHOOL,MUGUZI,SARAFATI,1817353039,PRIVATE,Yes
Comilla,Barura,105156,AGARAGRAM HIGH SCHOOL,AGRAGRAM,EGARAGRAM,1718296295,PRIVATE,Yes
Comilla,Barura,105194,RAMMOHAN TOMIZIA HIGH SCHOOL,RAMMOHAN,RAMMOHAN BAZAR,1309105194,PRIVATE,Yes
Comilla,Barura,133935,AL-AMIN I.S. RESIDENTIAL SCHOOL,PANCHTHUBI,PANCHTHUBI,1712327736,PRIVATE,No
Comilla,Barura,133959,"SUNRISE SCHOOL,BARURA",BARURA,BARURA,1819449223,PRIVATE,No
Comilla,Barura,134103,ODDA P.B.C.N. JUNIOR HIGH SCHOOL,ODDA,JHALAM BAZAR,1839093137,PRIVATE,No
Comilla,Barura,137517,LOGNOSAR EAST GOVT. PRIMARY SCHOOL,LOGNOSAR,LOGNOSAR,1727375614,GOVERNMENT PRIMARY,No
Comilla,Barura,137733,BARURA JUNIOR HIGH SCHOOL,JINSAR,BARURA,1943332705,PRIVATE,No
Comilla,Barura,138344,85 NO KHAJURIA GOVT PRIMARY SCHOOL,01 NO,POYALGACHA,1812742806,GOVERNMENT PRIMARY,No
Comilla,Barura,138396,DHULIAMURI GOVT. PRIMARY SCHOOL,03 NO,KALAKHAL,1309138396,GOVERNMENT PRIMARY,No
Comilla,Brahman Para,105196,JIROIN BOHUMUKHI HIGH SCHOOL,JIRUIN,JIRUIN,1736916181,PRIVATE,Yes
Comilla,Brahman Para,105197,POMKARA SIDDIQURE RA. AND HAKIM HIGH SCHOOL,POMKARA,EGARAGRAM,1309105197,PRIVATE,Yes
Comilla,Brahman Para,105198,NAZNEEN HIGH SCHOOL,SHIDLAI,SIDLAI,1718029541,PRIVATE,Yes
Comilla,Brahman Para,105199,TETABHUMI HIGH SCHOOL,NORTH TETABHUMI,HARIMONGAL,1309105199,PRIVATE,Yes
Comilla,Brahman Para,105200,SHIDLAI ASHRAF SECONDARY SCHOOL,SHIDLAI,SIDLAI,1309105200,PRIVATE,Yes
Comilla,Brahman Para,105201,MOHALAKSHMI PARA SHARIF HIGH SCHOOL,MOHALAKSHMI PARA,MOHALAKSHMI PARA,1309105201,PRIVATE,Yes
Comilla,Brahman Para,105202,ABDUR RAZZAK KHAN CHOWDHURY HIGH SCHOOL,DHANYADOUL,DHANYADOUL,1716338377,PRIVATE,Yes
Comilla,Brahman Para,105203,BHAGABAN GOVT. HIGH SCHOOL,BRAHMAN PARA,BRAHMAN PARA,1912205648,PUBLIC,No
Comilla,Brahman Para,105204,MADHABPUR HIGH SCHOOL,MADHOBPUR,MADHABPUR,1716965369,PRIVATE,Yes
Comilla,Brahman Para,105205,SHASHIDAL UNION HIGH SCHOOL,SHASHIDAL,SHASHIDAL,1716856221,PRIVATE,Yes
Comilla,Brahman Para,105207,DULALPUR S. M. & K. HIGH SCHOOL,DULALPUR,DULALPUR,1814414658,PRIVATE,Yes
Comilla,Brahman Para,105208,KANDUGHAR B.B.S. HIGH SCHOOL,KANDUGHAR,KANDUGHAR,1822190421,PRIVATE,Yes
Comilla,Brahman Para,105209,BARADUSHIA HIGH SCHOOL,BARADUSHIA,BARADUSHIA,1726110967,PRIVATE,Yes
Comilla,Brahman Para,105210,MALAPARA HIGH SCHOOL,MALAPARA,MALAPARA,1818594353,PRIVATE,Yes
Comilla,Brahman Para,105211,GOPAL NAGAR B.A.B. HIGH SCHOOL,GOPALNAGAR,GOPALNAGAR,1309105211,PRIVATE,Yes
Comilla,Brahman Para,105212,BERAKHALA ABDUL MATIN KHASRU GIRLS HIGH SCHOOL,BERAKHALA,BERAKHALA,1813547766,PRIVATE,No
Comilla,Brahman Para,105213,SHAHEBABAD LATIF ISMAIL HIGH SCHOOL,SHAHEBABAD,SAHEBABAD,1732946871,PRIVATE,Yes
Comilla,Brahman Para,105216,ZAHIDUL HOSSAIN HIGH SCHOOL,NAGAISH,NAGAISH,1818566531,PRIVATE,Yes
Comilla,Brahman Para,105218,M. A CHANDIPUR REZAUL HOQUE HIGH SCHOOL,ALUA,ALUA,1309105218,PRIVATE,Yes
Comilla,Brahman Para,105219,CHOWBBASH JAHANARA HIGH SCHOOL,CHOWBBASH,MANDABAG,1716268354,PRIVATE,Yes
Comilla,Brahman Para,105220,SHEIKH MUZIBUR RAHMAN HIGH SCHOOL BEJURA,BEJURA,BEJURA,1920124137,PRIVATE,Yes
Comilla,Brahman Para,105221,BAGRA MADHYAMIK BIDYALAYA,BAGRA,SALDANADI,1309105221,PRIVATE,Yes
Comilla,Brahman Para,105222,DIRGHA VOMI BANGABUNDU HIGH SCHOOL,DIRGHA VOMI,BRAHMANPARA,1309105222,PRIVATE,Yes
Comilla,Brahman Para,105223,EAST CHANDIPUR BANGABHANDU JUNIOR GIRLS SCHOOL,EAST CHANDIPUR,MALAPARA,1309105223,PRIVATE,No
Comilla,Brahman Para,105224,MAKIMPUR ABDUL MATIN KASHRU HIGH SCHOOL,MAKIMPUR,MAKIMPUR,1745929127,PRIVATE,Yes
Comilla,Brahman Para,105225,TAKAI HIGH SCHOOL,TAKAI,SAHEBABAD,1818959089,PRIVATE,Yes
Comilla,Brahman Para,137077,SHASHIDAL  GIRLS HIGH SCHOOL,SHASHIDAL,SHASHIDAL,1309137077,PRIVATE,No
Comilla,Brahman Para,137516,NALLA GOVT. PRIMARY SCHOOL,NALLA,DULALPUR,1816830139,GOVERNMENT PRIMARY,No
Comilla,Brahman Para,138610,BRAHMANPARA OCEAN HIGH SCHOOL,M A GONI ROAD,BRAHMANPARA,1867150150,PRIVATE,No
Comilla,Burichang,105256,BHARASAR HIGH SCHOOL,BHARASAR,SADAR  ICHHAPURA,1719801505,PRIVATE,Yes
Comilla,Burichang,105257,PANCHURA MADDHAMIK BIDDANIKETON,PANCHURA,CHARNAL,1710916514,PRIVATE,Yes
Comilla,Burichang,105258,LARIBAG HIGH SCHOOL,LARIBAG,SANKUCHAIL,1712084213,PRIVATE,Yes
Comilla,Burichang,105259,SUNDRAM MADHAMIK SCHOOL,SUNDRAM,JIAPUR,1818612011,PRIVATE,Yes
Comilla,Burichang,105260,CHANDSHAR HAZI MOGSUD ALI BUIYAN HIGH SCHOOL,CHANDSHAR,ZIAPUR,1309105260,PRIVATE,Yes
Comilla,Burichang,105261,KHARATAIYA HIGH SCHOOL,KHARATAIYA,KHARATAIYA GAZIPUR,1927202484,PRIVATE,Yes
Comilla,Burichang,105262,HARIPUR ADARSHA HIGH SCHOOL,HARIPUR,BURICHANG,1716610465,PRIVATE,Yes
Comilla,Burichang,105263,MOHISHMARA HIGH SCHOOL,MOHISHMARA,NANUR BAZAR,1818292944,PRIVATE,Yes
Comilla,Burichang,105264,ARAG ANANDAPUR ADARSHA HIGH SCHOOL,ARAG ANANDAPUR,BURICHANG,1818614837,PRIVATE,Yes
Comilla,Burichang,105265,SREMONTAPUR M A SATTER HIGH SCHOOL,SREMONTAPUR,KALIKAPUR,1753135106,PRIVATE,Yes
Comilla,Burichang,105266,SANKUCHAIL HIGH SCHOOL,SANKUCHAIL,SANKOCHAIL BAZAR,1309105266,PRIVATE,Yes
Comilla,Burichang,105267,RAMPUR HIGH SCHOOL,RAMPUR,RAMPUR,1710105838,PRIVATE,Yes
Comilla,Burichang,105268,BURICHONG ANANDA PILOT GOVT.HIGH SCHOOL,BURICHONG,BURICHONG,1913046858,PUBLIC,No
Comilla,Burichang,105269,BURICHANG KALI NARAYAN GIRLS HIGH SCHOOL,BURICHANG,BURICHANG,1309105269,PRIVATE,Yes
Comilla,Burichang,105270,NIMSAR HIGH SCHOOL,NIMSAR,NIMSAR,1712845248,PRIVATE,Yes
Comilla,Burichang,105271,CHHAY GRAM HIGH SCHOOL,COHOTTO HOREPUR,CHHAYGRAM BAZAR,1716612593,PRIVATE,Yes
Comilla,Burichang,105272,KAZIMUDDIN KHANDAKER HIGH SCHOOL,SHADOULOT PUR,KALAKOCHUA,1711390093,PRIVATE,Yes
Comilla,Burichang,105273,BHARELLA SHAH NURUDDIN HIGH SCHOOL,BHARELLA,BHARELLA,1832210111,PRIVATE,Yes
Comilla,Burichang,105275,PURNAMOTI MANSUR AHMED HIGH SCHOOL,PURNAMOTI,PURNAMOTI,1718055484,PRIVATE,Yes
Comilla,Burichang,105276,PIR JATRAPUTR HIGH SCHOOL,PIR JATRAPUR,PIR JATRAPUR,1748084447,PRIVATE,Yes
Comilla,Burichang,105277,PURBA HURA HIGH SCHOOL,PURBA HURA,NANUAR BAZAR,1309105277,PRIVATE,Yes
Comilla,Burichang,105278,MURSHEDA BEGUM SECONDARY SCHOOL,AGGAPUR,KALIKAPUR,1720954357,PRIVATE,Yes
Comilla,Burichang,105279,BAKSIMUL HIGH SCHOOL,BAKSIMUL,BAKSIMAIL,1716323368,PRIVATE,Yes
Comilla,Burichang,105280,TAHERA JUNAB ALI GIRLS HIGH SCHOOL ,NIMSAR,NIMSAR,1710486266,PRIVATE,Yes
Comilla,Burichang,105281,MITHILAPUR HIGH SCHOOL,MITHILAPUR,NANUAR BAZAR,1720483935,PRIVATE,Yes
Comilla,Burichang,105282,BARAIR HAZI CHERAG ALI HIGH SCHOOL,BARAIR,KABILA BAZAR,1817606676,PRIVATE,Yes
Comilla,Burichang,105283,BURICHONG HAZI FAZAR ALI HIGH SCHOOL,BURICHONG,BURICHONG,1715707718,PRIVATE,Yes
Comilla,Burichang,105284,HORIN DHARA HIGH SCHOOL,HARINDHARA,MAINAMATI BAZAR,1720099930,PRIVATE,Yes
Comilla,Burichang,105285,RAJAPUR HIGH SCHOOL,RAJAPUR,SANKUCHAIL BAZAR,1714595310,PRIVATE,Yes
Comilla,Burichang,105286,KUSMPUR HIGH SCHOOL,KUSMPUR,RAMPUR,1914532936,PRIVATE,Yes
Comilla,Burichang,105287,JAGATPUR HIGH SCHOOL,JAGATPUR,MADRASA JAGATPUR,1629805571,PRIVATE,No
Comilla,Burichang,105288,BURICHANG MODEL ACADEMY,BURICHANG ,BURICHANG,1817536945,PRIVATE,Yes
Comilla,Burichang,105289,KANGSHANAGAR HIGH SCHOOL,KANGSHANAGAR,KANSANAGAR,1743945534,PRIVATE,Yes
Comilla,Burichang,105290,BALIKHARA ABDUL MATIN KHASRU HIGH SCHOOL,BALIKHARA,BALIKHARA,1721605753,PRIVATE,Yes
Comilla,Burichang,105291,DHAKKHI SAMPUR  ALI  NEWAZ BHUIYAN TECNICAL HIGH SCHOOL,DAKSHIN SHYAMPUR,PIR JATRAPUR,1732852435,PRIVATE,Yes
Comilla,Burichang,105292,JAGATPUR GIRLS HIGH SCHOOL,JAGATPUR,MADRASHA JAGATPUR,1743909661,PRIVATE,No
Comilla,Burichang,105293,CAMBRIDGE INTERNATIONAL SCHOOL AND COLLEGE,BURICHANG,BURICHANG,1625261387,PRIVATE,No
Comilla,Burichang,105294,KAKIARCHAR IDEAL TECHNICAL HIGH SCHOOL,KAKIARCHAR,KORPAI,1812728952,PRIVATE,Yes
Comilla,Burichang,131300,BARASHWAR HIGH SCHOOL,BARESHWAR,BARESHWAR,1728421540,PRIVATE,Yes
Comilla,Burichang,134909,DHAKA MISSION SCHOOL,NIMSAR,NIMSAR,1848366880,PRIVATE,No
Comilla,Burichang,134910,SHIKERPUR HIGH SCHOOL,SHIKERPUR,SHIKERPUR,1849314815,PRIVATE,No
Comilla,Burichang,137518,DAKSHINGRAM GOVT. PRIMARY SCHOOL,DAKHINGRAM,SANKUCHAIL BAZAR,1816832477,GOVERNMENT PRIMARY,No
Comilla,Burichang,138153,JADUPUR GOVT. PRIMARY SCHOOL,JADUPUR,BURICHANG,1309138153,GOVERNMENT PRIMARY,No
Comilla,Chandina,105340,KOILAIN TULPAI HIGH SCHOOL,LAKSHMIPUR,KOILAIN,1733122795,PRIVATE,Yes
Comilla,Chandina,105341,OXFORD INTERNATIONAL SCHOOL,"HARUN TOWER, DHANSIRI",CHANDINA,1721320961,PRIVATE,No
Comilla,Chandina,105342,ABEDA NUR GIRLS HIGH SCHOOL,GALLAI,GALLAI,1718573791,PRIVATE,Yes
Comilla,Chandina,105343,ZOBEDA MAMATAZ GIRLS HIGH SHCOOL,MAHICHAIL,MAHICHAIL,1715889581,PRIVATE,Yes
Comilla,Chandina,105344,ALABOKSHA JUNIOR GIRLS SCHOOL,BARARA,BARERA,1309105344,PRIVATE,Yes
Comilla,Chandina,105345,MADHAIA BAZAR SADIM HIGH SCHOOL,MADHAIA,MADHAIA BAZAR,1814790049,PRIVATE,Yes
Comilla,Chandina,105346,ETHBARPUR AZAM HIGH SCHOOL,SAIKUT,CHILORA BAZAR,1714470429,PRIVATE,Yes
Comilla,Chandina,105347,CHANDINA DR. FIROZA PILOT GIRL'S HIGH SCHOOL,CHANDINA 5 ,CHANDINA,1309105347,PRIVATE,Yes
Comilla,Chandina,105348,CHANDINA GOVT. MODEL PILOT HIGH SCHOOL,CHANDINA,CHANDINA,17626221447,PUBLIC,Yes
Comilla,Chandina,105349,DOLLAI NOWAB PUR AHSAULLAH HIGH SCHOOL,NURPUR,DOLLAI NOWBPUR,1818023284,PRIVATE,Yes
Comilla,Chandina,105350,BARERA HIGH SCHOOL,BARERA,BARERA,1713636069,PRIVATE,Yes
Comilla,Chandina,105351,KADUTI HIGH SCHOOL,KADUTI,KADUTI,1814228034,PRIVATE,Yes
Comilla,Chandina,105352,MAHICHAIL HIGH SCHOOL,MAHICHAIL,MAHICHAIL,1716145552,PRIVATE,Yes
Comilla,Chandina,105353,AMBORPUR HIGH SCHOOL,AMBORPUR,AMBARPUR,1812451760,PRIVATE,Yes
Comilla,Chandina,105354,KANGAI HIGH SCHOOL,KANGAI,KANGAI,1309105354,PRIVATE,Yes
Comilla,Chandina,105355,MOHANPUR JANATA HIGH SCHOOL,MOHANPUR,KANGAI,1819603037,PRIVATE,Yes
Comilla,Chandina,105357,"SREEMONTAPUR HIGH SCHOOL,CHANDINA",SREEMONTAPUR,CHANDINA,1819666525,PRIVATE,Yes
Comilla,Chandina,105358,DHERERA HIGH SCHOOL,DHERERA,JHALAM,1309105358,PRIVATE,Yes
Comilla,Chandina,105359,BHOMAR KANDI HIGH SCHOOL,BHOMAR KANDI,BHOMARKANDI,1720217809,PRIVATE,Yes
Comilla,Chandina,105360,JOAG AHAMMEDIA HIGH SCHOOL,JOAG,JOAG,1819689587,PRIVATE,Yes
Comilla,Chandina,105361,A.M.F. HIGH SCHOOL,"à§¯ à¦¨à¦‚ à¦®à¦¾à¦‡à¦œà¦–à¦¾à¦°, à¦«à¦¾à¦",BADARPUR BAZAR,1819442530,PRIVATE,Yes
Comilla,Chandina,105362,BARA GOBINDAPUR ALI MIAH BHUIYAN HIGH SCHOOL,BARA GOBINDAPUR,CHANDINA,1714595352,PRIVATE,Yes
Comilla,Chandina,105363,KARTALA ADARSHA GIRLS HIGH SCHOOL,KARTALA,BHOMORKANDI,1818938652,PRIVATE,Yes
Comilla,Chandina,105364,HARONG HIGH SCHOOL,HARONG,CHANDINA,1309105364,PRIVATE,Yes
Comilla,Chandina,105365,BARKAIT UDAYAN HIGH SCHOOL,BARKAIT,BARKAIT,1716629605,PRIVATE,Yes
Comilla,Chandina,105366,KUTUMBAPUR HIGH SCHOOL,KUTUMBAPUR,SHAHARPAR,1819822029,PRIVATE,Yes
Comilla,Chandina,105367,ABEDA-NOOR HIGH SCHOOL,GALLAI,GALLAI,1710106149,PRIVATE,Yes
Comilla,Chandina,105368,PEPUIA HIGH SCHOOL,PEPUIA,BARAIYA KRISHNAPUR,1818872335,PRIVATE,Yes
Comilla,Chandina,105370,DOLLAI NOWABPUR GIRLS HIGH SCHOOL,NOWABPUR,DOLLAI NOWABPUR,1817503625,PRIVATE,Yes
Comilla,Chandina,105371,PANIPARA SHAHID SMRITI JUNIOR GIRLS SCHOOL,PANIPARA,BHOMARKANDI,1731134104,PRIVATE,Yes
Comilla,Chandina,131320,RASULPUR ADARSHA HIGH SCHOOL,RASULPUR,BADARPUR BAZAR,1740861253,PRIVATE,Yes
Comilla,Chandina,133826,ORAINE  HIGH SCHOOL,ORAINE,JOAG,1716038277,PRIVATE,Yes
Comilla,Chandina,133906,CHILORA PURBA AMBERPUR KARIGORI HIGH SCHOOL,CHILORA,CHILORA,1812742794,PRIVATE,Yes
Comilla,Chandina,134176,MATRI BHUMI MODEL SCHOOL AND COLLEGE,DHANSIRI,CHANDINA,1877761110,PRIVATE,No
Comilla,Chandina,137519,SHALCHAR GOVT. PRIMARY SCHOOL,SHALCHAR,RAMMOHAN,1718724369,GOVERNMENT PRIMARY,No
Comilla,Chandina,139131,BIR BIKRAM M A MALEK SCHOOL AND COLLEGE,CHHAYKOT,CHANDINA,1719523125,PRIVATE,No
Comilla,Chauddagram,105406,BATISA SECONDARY GIRLS SCHOOL,BATISA,BATISHA,1818734519,PRIVATE,Yes
Comilla,Chauddagram,105407,NALGHAR HIGH SCHOOL,NALGHAR,NALGHAR BAZAR,1718682461,PRIVATE,Yes
Comilla,Chauddagram,105408,MUNSHIR HAT TAHERA KHATUN GIRLS HIGH SCHOOL,MESHTALA,MESHTALI BAZAR,1309105408,PRIVATE,Yes
Comilla,Chauddagram,105409,NARAYAN PUR HIGH SCHOOL,NARAYANPUR,AMJADNAGAR,1711970810,PRIVATE,Yes
Comilla,Chauddagram,105410,PADUA SUFIA RAHMAN HIGH SCHOOL,PADUA,PADUA,1715738700,PRIVATE,Yes
Comilla,Chauddagram,105411,ALKARA HAFIZUL ISLAM CHOWDHURY HISH SCHOOL,ALKARA,ALKARA-à§¦à§¨,1815607557,PRIVATE,Yes
Comilla,Chauddagram,105413,MEAH BAZAR TOSHAN RAFIQ GIRLS HIGH SCHOOL,BALGHOR,MIAHBAZAR,1812805006,PRIVATE,Yes
Comilla,Chauddagram,105414,AMIR HOSSAIN CHOWDHURY IDEAL HIGH SCHOOL,UTTAR BETIARA,BORDAN,1812382456,PRIVATE,Yes
Comilla,Chauddagram,105415,HAZI MANIR UDDIN GIRLS HIGH SCHOOL,KARPATI/BAILPUR,MARKATA BAZAR,1817327185,PRIVATE,Yes
Comilla,Chauddagram,105416,PAYERKHOLA R.M.B.R. GIRLS HIGH SCHOOL,PAYER KHOLA,BORDOIN,1817096943,PRIVATE,Yes
Comilla,Chauddagram,105417,SHAKCHI SYED BARI HIGH SCHOOL,SHAKCHI,LATIFA SIKDER,1818020528,PRIVATE,Yes
Comilla,Chauddagram,105418,CHATIANI ADARSHA HIGH SCHOOL,CHATIANI,KHIRNASHAL,1817602182,PRIVATE,Yes
Comilla,Chauddagram,105419,GUNABATI AL FARABI HIGH SCHOOL,KARTAM,GUNABATI,1817081927,PRIVATE,Yes
Comilla,Chauddagram,105420,FELNA HIGH SCHOOL,FELNA,KHIRONSHAL,1817116082,PRIVATE,Yes
Comilla,Chauddagram,105422,BHAT BARI IDEAL HIGH SCHOOL,BHAT BARI,CHAK LAKHI PUR,1813178899,PRIVATE,Yes
Comilla,Chauddagram,105423,BHATORA KALJOYE BIDDA NIKATON,BHATORA,ROWSONABAD,1818489524,PRIVATE,Yes
Comilla,Chauddagram,105424,KAJI AHMED ALI HIGH SCHOOL,BAKGRAM,ALKARA,1815173034,PRIVATE,Yes
Comilla,Chauddagram,105425,MOSTFA KAMAL HIGH SCHOOL,KANKAPAIT,KANKAPAIT,1819019191,PRIVATE,Yes
Comilla,Chauddagram,105426,MORKOTA RABEYA ARSAD JR  HIGH SCHOOL,MORKOTA,MORKOTA BAZAR,1309105426,PRIVATE,Yes
Comilla,Chauddagram,105427,CHAUDDAGRAM H.J. GOVT. PILOT MODEL HIGH SCHOOL,SREEPUR,CHOUDDAGRAM,1309105427,PUBLIC,Yes
Comilla,Chauddagram,105428,CHOUDDAGRAM SECONDARY PILOT GIRLS HIGH SCHOOL,RAMRAIGRAM,CHOUDDAGRAM,1729645901,PRIVATE,Yes
Comilla,Chauddagram,105429,K.G. AHMED GIRLS HIGH SCHOOL,CHEORA,CHEORA,1815280508,PRIVATE,Yes
Comilla,Chauddagram,105430,PAYER KHOLA HIGH SCHOOL,PAYERKHOLA,BORDAIN,1818909596,PRIVATE,Yes
Comilla,Chauddagram,105431,BATISA SECONDARY SCHOOL,BATISA,BATISHA,1309105431,PRIVATE,Yes
Comilla,Chauddagram,105432,CHEORA B.F. HIGH SCHOOL,CHEORA,CHEORA,1817513358,PRIVATE,Yes
Comilla,Chauddagram,105433,SALAKANDI G.C HIGH SCHOOL,TULA PUSKARNI,GHOLPASHA,1819140799,PRIVATE,Yes
Comilla,Chauddagram,105434,SRIPUR PRASANNA ACADEMY,SREEPUR,SREEPUR BARI,1836155376,PRIVATE,Yes
Comilla,Chauddagram,105435,GUNABATI BOHUMUKHI HIGH SCHOOL,GUNABATI,GUNABATI,1747260730,PRIVATE,Yes
Comilla,Chauddagram,105436,KASHINAGOR B.M. HIGH SCHOOL,OLIPUR,KASHINAGOR,1727040444,PRIVATE,Yes
Comilla,Chauddagram,105437,MUNSIRHAT HIGH SCHOOL,MESTALA,MESTALI BAZAR,1309105437,PRIVATE,Yes
Comilla,Chauddagram,105438,HIGULA HASANIA HIGH SCHOOL,HIGULA,KANAKAPAIT,1732975667,PRIVATE,Yes
Comilla,Chauddagram,105439,CHANDKORA SAKADAR ALI SECONDARY SCHOOL,CHANDKORA,AKOTA BAZAR,1309105439,PRIVATE,Yes
Comilla,Chauddagram,105440,SHANGISHWOR HIGH SCHOOL,SHANGISHWOR,SANGISHWAR,1717910170,PRIVATE,Yes
Comilla,Chauddagram,105441,TARASHAIL HIGH SCHOOL,TARASHAIL,TARASHAIL,1817077880,PRIVATE,Yes
Comilla,Chauddagram,105442,KADAIR HIGH SCHOOL,KADAIR,KADAIR BAZAR,1811205627,PRIVATE,Yes
Comilla,Chauddagram,105443,DHORKARA  HIGH SCHOOL,DHORKARA,DHORKARA,1711070440,PRIVATE,Yes
Comilla,Chauddagram,105444,AMANGONDA MODEL HIGH SCHOOL,AMANGONDA DHAKA CHITTAGONG HIGH WAY,GHOLPASHA,1814855075,PRIVATE,Yes
Comilla,Chauddagram,105445,KULIARA HIGH SCHOOL,KULIARA,PATADDA,1815481891,PRIVATE,Yes
Comilla,Chauddagram,105446,KHIRONSHAL KAZI JAFOR AHMED HIGH SCHOOL,KHIRONSHAL,KHIRANSHAL,1309105446,PRIVATE,Yes
Comilla,Chauddagram,105447,DHOPA KHILA HIGH SCHOOL,DHOPAKHILA,ALKORA,1309105447,PRIVATE,Yes
Comilla,Chauddagram,105448,JOY MANGALPUR ADARSHA HIGH SCHOOL,JOY MANGALPUR,JOYMANGALPUR,1819127128,PRIVATE,Yes
Comilla,Chauddagram,105449,LUDIARA JAHIR AHMAED GIRLS HIGH SCHOOL,LUDIARA,PATADDA,1819111097,PRIVATE,Yes
Comilla,Chauddagram,105450,GUNABATI GIRLS HIGH SCHOOL,KARTAM,GUNABATI,1827114914,PRIVATE,Yes
Comilla,Chauddagram,105451,RANIR BAZAR SECONDARY SCHOOL,SHAHAPUR ,DARBESHPUR,1839218220,PRIVATE,Yes
Comilla,Chauddagram,105452,UNKOT HIGH SCHOOL,UNKOT,UNKOT,1817674926,PRIVATE,Yes
Comilla,Chauddagram,105453,BUDHARA HIGH SCHOOL,BUDHARA,GUNABARTI,1728133964,PRIVATE,Yes
Comilla,Chauddagram,105454,RAMPUR HIGH SCHOOL,RAMPUR,BIJOYKARA,1816096493,PRIVATE,Yes
Comilla,Chauddagram,105455,LAKSHMIPUR HIGH SCHOOL,LAKSHMIPUR,LAKSHIMPUR,1818594139,PRIVATE,Yes
Comilla,Chauddagram,105456,DURGAPUR  HIGH SCHOOL,DURGAPUR,KADAIR BAZAR,1817004423,PRIVATE,Yes
Comilla,Chauddagram,105457,DHONIS KARA HAFEZA KHATUN MEMORIAL HIGH  SCHOOL,DHONIS KARA,NALGHAR BAZAR,1711715304,PRIVATE,Yes
Comilla,Chauddagram,105458,FAIZUNNESA IDEAL  GIRL.S HIGH SCHOOL,OLI PUR,KASHINAGAR,1817317365,PRIVATE,No
Comilla,Chauddagram,105517,MEAH BAZAR LATIFUN NESA HIGH SCHOOL,BELGHAR,MEAH BAZAR,1819110024,PRIVATE,Yes
Comilla,Chauddagram,134510,CHOUMUHANI BAZAR MOJIBUL HAQ HIGH SCHOOL,KAIYANI,CHOUMUHANI,1711020828,PRIVATE,Yes
Comilla,Chauddagram,137515,SUKCHAIL GOVT. PRIMARY SCHOOL,SUKCHAIL,SUKCHAIL,1838475567,GOVERNMENT PRIMARY,No
Comilla,Chauddagram,138475,SYEDA ANJUMAN ARA GIRLS SCHOOL,NARANKARA,JAGANNATH DIGHI,1794778788,PRIVATE,No
Comilla,Chauddagram,138565,18 NO KALIKAPUR GOVERNMENT PRIMARY SCHOOL,KALIKAPUR,CHUPUYA MADRASA,1715031328,GOVERNMENT PRIMARY,No
Comilla,Chauddagram,138693,BIJOYKARA GOVERNMENT PRIMARY SCHOOL,BIJOYKARA,BIJOYKARA,1778566866,GOVERNMENT PRIMARY,No
Comilla,Sadar Dakshin,105699,KALI BAZAR SECONDARY SCHOOL,MONIPUR,KALI BAZAR,1715035105,PRIVATE,Yes
Comilla,Sadar Dakshin,105700,SHALBON HIGH SCHOOL,SHALMANPUR,KOTBARI,1788530464,PRIVATE,Yes
Comilla,Sadar Dakshin,105701,BARAPARA AMENA BEGUM GIRLS HIGH SCHOOL,BARAPARA,BIJOYPUR,1817072113,PRIVATE,Yes
Comilla,Sadar Dakshin,105703,OLIR BAZAR ADARSHA HIGH SHCOOL,JORPUSKARNI,OLIR BAZAR,1818081145,PRIVATE,Yes
Comilla,Sadar Dakshin,105704,KAMALPUR HIGH SCHOOL,KAMOLPUR,KAMOLPUR,1716396806,PRIVATE,Yes
Comilla,Sadar Dakshin,105705,SHAKTALA HIGH SCHOOL,SHAKTALA LAKSHAM ROAD COMILLA,COMILLA,1818024124,PRIVATE,Yes
Comilla,Sadar Dakshin,105706,KOMALLA SECONDARY SCHOOL,KHEAIS,BALURCHAR,1734000386,PRIVATE,Yes
Comilla,Sadar Dakshin,105707,RAJAPARA M.M.ALI GIRLS HIGH SCHOOL,RAJAPARA,RAJAPARA,1716432765,PRIVATE,Yes
Comilla,Sadar Dakshin,105709,GOVERNMENT LABORATORY HIGH SCHOOL,KOTBARI,KOTBARI,1817128435,PUBLIC,No
Comilla,Sadar Dakshin,105710,"JANGALIA POWER DEVELOPMENT BOARD  HIGH SCHOOL, COMILLA",JANGALIA,COMILLA,1309105710,PRIVATE,No
Comilla,Sadar Dakshin,105711,CHOWARA M.M SECONDARY SCHOOL,ULORCHOR,BAZAR CHOWARA,1836287811,PRIVATE,Yes
Comilla,Sadar Dakshin,105712,BIJOYPUR HIGH SCHOOL,DURGAPUR,BIJOYPUR,1813770921,PRIVATE,Yes
Comilla,Sadar Dakshin,105713,KANESH TALA  HIGH SCHOOL,KANESHTALA,BALURCHAR,1842085783,PRIVATE,Yes
Comilla,Sadar Dakshin,105714,NEWRA M.I.HIGH SCHOOL,NEWRA/131,RAJA PARA,1554347954,PRIVATE,Yes
Comilla,Sadar Dakshin,105715,NAZRUL  ACADEMY,HEMZORA,PIPULIA BAZAR,1726233612,PRIVATE,Yes
Comilla,Sadar Dakshin,105717,BELTALI HIGH SCHOOL,RAM NAGAR,ELAHIPUR,1309105717,PRIVATE,Yes
Comilla,Sadar Dakshin,105718,BAMISHA HAZI A. ALI HIGH SCHOOL,KING BAMISHA,BAMISHA,1712399249,PRIVATE,Yes
Comilla,Sadar Dakshin,105719,SUVAPUR MONOYARA JUNIOR HIGH SCHOOL,SUVAPUR,BALUR CHAR,1723820323,PRIVATE,Yes
Comilla,Sadar Dakshin,105720,DHANESHWAR SECONDARY,DHANESHWAR,RAJAPARA,1881004580,PRIVATE,Yes
Comilla,Sadar Dakshin,105721,LALBAG ROWSHAN ASHRAF HIGH SCHOOL,LALBAG,LALBAG,1721829833,PRIVATE,Yes
Comilla,Sadar Dakshin,105722,CHOWARA GIRLS HIGH SCHOOL,"ULURCHAR, COMILLA-CHATTOGRAM TRANK ROAD",BAZAR CHOWARA,1811343059,PRIVATE,Yes
Comilla,Sadar Dakshin,105723,LOLBARIA HIGH SCHOOL,LOLBARIA,BIJOYPUR,1711737643,PRIVATE,Yes
Comilla,Sadar Dakshin,105724,GOAL GAON M. A. HIGH SCHOOL,GOALGAON,DANPUR,1814319939,PRIVATE,Yes
Comilla,Sadar Dakshin,105725,SHISPUR HAJI RAZA MIA HIGH SCHOOL,SHISPUR,PIPULIA BAZAR,1819132038,PRIVATE,Yes
Comilla,Sadar Dakshin,105726,LALMAI HIGH SCHOOL,BORO DHARMAPUR,LALMAI,1726820330,PRIVATE,Yes
Comilla,Sadar Dakshin,105727,MADHYAM BIJOYPUR ADARSHA HIGH SCHOOL,ONE NUMBER MADHYAM BIJOY PUR,BIJOYPUR,1716293105,PRIVATE,Yes
Comilla,Sadar Dakshin,105728,BATABARIA GIRL'S HIGH SCHOOL,BATABARIA,HALIMANAGOR,1715217194,PRIVATE,Yes
Comilla,Sadar Dakshin,105729,BHOBUNPUR PANCHAGRAM HIGH SCHOOL,BHOBUNPUR,SUAGANJ,1715503224,PRIVATE,Yes
Comilla,Sadar Dakshin,131304,COMILLA RESIDENTIAL SCHOOL,LAKSAM ROAD,ELAHIPUR,8162052,PRIVATE,No
Comilla,Sadar Dakshin,131316,RAZAR KHOLA HIGH SCHOOL,RAZAR KHOA,BIJOYPUR,1818842599,PRIVATE,Yes
Comilla,Sadar Dakshin,134271,COMILLA IDEAL SCHOOL & COLLEGE,"GONDHMOTI, COTBARI.",KOTIBARI,1718345785,PRIVATE,No
Comilla,Sadar Dakshin,134912,BORDER GUARD PUBLIC SCHOOL,BGB,KOTBARI,1769617441,PRIVATE,Yes
Comilla,Sadar Dakshin,137631,BANGLADESH PALLY UNNAYAN ACADEMY MODEL SCHOOL,BARD CAMPUS,KOTBARI,1944774099,PRIVATE,No
Comilla,Sadar Dakshin,138365,BEPZA PUBLIC SCHOOL AND COLLEGE,"EPZ ROAD, MADDHAM ASHRAFPUR",COMILLA,1717518007,PRIVATE,No
Comilla,Daudkandi,105369,CHINA MURA L N HGIH SCHOOL,CHINAMURA,CHINAMURA,1813606049,PRIVATE,Yes
Comilla,Daudkandi,105520,DAUDKANDI ADARSHA  HIGH SCHOOL,DAUDKANDI,DAUDKANDI,1712165195,PRIVATE,Yes
Comilla,Daudkandi,105521,SOUTH NARANDIA HIGH SCHOOL,NARANDIA,RAFARDIA,1736342683,PRIVATE,Yes
Comilla,Daudkandi,105523,SUNDAL PUR HIGH SCHOOL,SUNDALPUR,DASPARA,1823221480,PRIVATE,Yes
Comilla,Daudkandi,105524,HATKHOLA ML HIGH SCHOOL,464,HATKHOLA,1834030464,PRIVATE,Yes
Comilla,Daudkandi,105526,SREERAYER CHAR S.I.M. HIGH SCHOOL,SREERAYER CHAR,SREERAYER CHAR,1718907405,PRIVATE,Yes
Comilla,Daudkandi,105530,DAUDKANDI POURASAVA HIGH SCHOOL,TUZERVANGA,DAUDKANDI,1725104835,PRIVATE,Yes
Comilla,Daudkandi,105531,ELLIOTGONJ R.B.HIGH SCHOOL,MUBARAKPUR,ELIOTGONJ,1710819589,PRIVATE,Yes
Comilla,Daudkandi,105533,KAWADI HIGH SCHOOL,KAWADI,KAWADI,1813530666,PRIVATE,Yes
Comilla,Daudkandi,105534,BARAPARA FULMATI GIRLS' HIGH SCHOOL,BARAPARA,GOURIPUR,1309105534,PRIVATE,Yes
Comilla,Daudkandi,105535,SHAHID NAGAR M.A JALIL HIGH SCHOOL,CHANDGAON,CHANDGAON,1309105535,PRIVATE,Yes
Comilla,Daudkandi,105538,GOAL MARI HAZRAT A.K.J (R) HIGH SCHOOL,GOALMARI,GOALMARI,1823390845,PRIVATE,Yes
Comilla,Daudkandi,105539,GOURIPUR BILKIS MOSHARRAF GIRLS HIGH SCHOOL,GOURIPUR,GOURIPUR,1819117605,PRIVATE,Yes
Comilla,Daudkandi,105542,CHASAI HIGH SCHOOL,CHASAI,CHASAI,1881135145,PRIVATE,Yes
