DISTRICT,UPAJILA,EIIN,INSTITUTE_NAME,ADDRESS,POST,MOBAILE,MANAGEMENT,MPO
Comilla,Muradnagar,105999,D.R. GOVT. HIGH SCHOOL,KISMATPUR NABIPUR,MURADNAGAR,1309105999,PUBLIC,No
Comilla,Muradnagar,106000,GOMTA ISHAKIA HIGH SCHOOL,GOMTA,ELLIOTGONJ,1718023934,PRIVATE,Yes
Comilla,Muradnagar,106001,GHORASHAL ABDUL KARIM HIGH SCHOOL,GHORASHAL,GOHRASHAL MADRASAH,1911295665,PRIVATE,Yes
Comilla,Muradnagar,106002,BANSKAIT P.J.HIGH SCHOOL,BANSKAIT,BANSKAIT,1723343380,PRIVATE,Yes
Comilla,Muradnagar,106003,SREEKAIL KRISNA KUMAR HIGH SCHOOL,SREEKAIL-7,SREEKAIL,1819058229,PRIVATE,Yes
Comilla,Muradnagar,106004,KAMALLA D.R.S HIGH SCHOOL,KAMALIA,KAMALLA,1716185128,PRIVATE,Yes
Comilla,Muradnagar,106005,ANDIKOT SAYED GOLAM JILANI HIGH SCHOOL,ANDIKOT,SIDDHIGONJ,1724629521,PRIVATE,Yes
Comilla,Muradnagar,106006,PANCHPUKURIA BAZAR HIGH SCHOOL,PANCHPUKURIA BAZAR,PANCHPUKURIA BAZAR (3519),1722297829,PRIVATE,Yes
Comilla,Muradnagar,106007,KURBANPUR G.M HIGH SCHOOL,KURBANPUR,KORBANPUR,1712496375,PRIVATE,Yes
Comilla,Muradnagar,106008,JATRAPUR A. K. HIGH SCHOOL,JATRAPUR,JATARAPUR,1740843510,PRIVATE,Yes
Comilla,Muradnagar,106009,GANGER KOT HIGH SCHOOL,GANGER KOT,GANGERKOT,1818969250,PRIVATE,Yes
Comilla,Muradnagar,106010,PRAMTALA SABDAR KHAN HIGH SCHOOL,PARAMTALA,PARAMTALA,1819072543,PRIVATE,Yes
Comilla,Muradnagar,106011,AZIFA KHATOON HIGH SCHOOL,CHAPITALA,CHAPITALA,1722461800,PRIVATE,Yes
Comilla,Muradnagar,106012,BISHNUPUR HIGH SCHOOL,BISHNUPUR,PAK GAZIPUR,1309106012,PRIVATE,Yes
Comilla,Muradnagar,106013,DARORA DINESH CHANDRA HIGH SCHOOL,DARORA,DARORA,1309106013,PRIVATE,Yes
Comilla,Muradnagar,106014,AKBBARER NESA GIRLS HIGH SCHOOL,RAMCHANDRAPUR-MURADNAGAR ROAD,RAMCHANDRA PUR,1717107620,PRIVATE,Yes
Comilla,Muradnagar,106015,PANCHKITTA HIGH SCHOOL,PANCHKITTA,PACHKINTA,1939566724,PRIVATE,Yes
Comilla,Muradnagar,106016,NAZAM UDDIN BHUIYAN GIRLS HIGH SCHOOL,SREEKAIL,SREEKAIL,1711270653,PRIVATE,Yes
Comilla,Muradnagar,106017,CHLIA KANDI INDROBHUSAN HIGH SCHOOL,CHALIAKANDI,CHALIAKANDI,1814162546,PRIVATE,Yes
Comilla,Muradnagar,106018,BEGUM JAHANARA HAQUE GIRLS HIGH SCHOOL,HAIDARABAD,HAIDARABAD,1739562864,PRIVATE,Yes
Comilla,Muradnagar,106019,BAKHAR NAGAR UCHHA BIDYA NIKETAN,BAKHAR NAGAR,BAKHARNAGAR,1721709262,PRIVATE,Yes
Comilla,Muradnagar,106020,JANGAL BADSHA MIA IDEL GIRLS HIGH SCHOOL,JANGAL,GAZIPUR,1732959933,PRIVATE,Yes
Comilla,Muradnagar,106021,URISWAR GIRLS HIGH SCHOOL,URISWAR,BANSKAIT,1812059142,PRIVATE,Yes
Comilla,Muradnagar,106022,HANIF SARKER HIGH SCHOOL,TANKI,TANKI,1818976917,PRIVATE,Yes
Comilla,Muradnagar,106023,PAYAB  HAJI  ABDUL  GHANI  HIGH  SCHOOL,PAYAB,DARORA,1815443461,PRIVATE,Yes
Comilla,Muradnagar,106024,DHAMGAR ADARSHA HIGH SCHOOL,DHAMGAR,MURADNAGAR,1715722551,PRIVATE,Yes
Comilla,Muradnagar,106025,KAZIATAL RAHIM RAHMAN MOLLA HIGH SCHOOL,KAZIATAL,KAZIATAL,1714469811,PRIVATE,Yes
Comilla,Muradnagar,106027,NARGIS NAZRUL BIDHYA NIKETAN,BANGARA BAZAR THANA,BANGARA,1309106027,PRIVATE,Yes
Comilla,Muradnagar,131199,D D S Y HIGH SCHOOL,DHANIRAMPUR,GHORASHAL MADRASHA,1818977059,PRIVATE,No
Comilla,Muradnagar,134908,HATASH ADRASHA  F.I JUNIOR SCHOOL,HATASH,BANG GORA,1710385908,PRIVATE,No
Comilla,Muradnagar,136775,SAIN UDDIN SARKER JUNIOR SCHOOL,KRISHNAPUR,KRISHNAPUR,1722108277,PRIVATE,No
Comilla,Muradnagar,137513,62NO. TANKI GOVT. PRIMARY SCHOOL,TANKI,TANKI,1818587077,GOVERNMENT PRIMARY,No
Comilla,Muradnagar,137857,GUNJAR (N) GOVT. PRIMARY SCHOOL,GUNJAR,COMPANYGONJ,1716498118,GOVERNMENT PRIMARY,No
Comilla,Muradnagar,138284,PANDUGHAR SAMSUDDIN AHAMMAD BHUIYAN JUNIOR HIGH SCHOOL,PANDUGHAR,PANDUGHAR,1746213781,PRIVATE,No
Comilla,Muradnagar,139276,SUSUNDA H R B JUNIOR HIGH SCHOOL,SUSUNDA,SUSUNDA,1641323652,PRIVATE,No
Comilla,Nangalkot,106073,SONDAIL HIGH SCHOOL,SONDAIL,SONDAIL,1715277096,PRIVATE,Yes
Comilla,Nangalkot,106074,NANGALKOT A.R. MODEL GOVT. HIGH SCHOOL,HORIPUR /18 LAKSAM,NANGALKOT,1714269898,PUBLIC,Yes
Comilla,Nangalkot,106075,BELGHOR GOSAI  BAZAR HIGH SCHOOL,BELGHOR,BELGHAR GOSAI BAZAR,1818974781,PRIVATE,Yes
Comilla,Nangalkot,106076,UTTAR SHAKTOLI ADARSHA  HIGH SCHOOL,UTTAR SHAKTOLI,PERIA BAZAR,1876456613,PRIVATE,Yes
Comilla,Nangalkot,106077,BATTALIA A. MOTIN HIGH SCHOOL,KASHIPUR,BATALI BAZAR,1788360032,PRIVATE,Yes
Comilla,Nangalkot,106078,BAIARA ZAINAL HIGH SCHOOL,BAIARA,BAIARA  BAZAR,1716512967,PRIVATE,Yes
Comilla,Nangalkot,106079,SIZIARA  HIGH SCHOOL,SIZIARA,SIJIARA,1709264708,PRIVATE,Yes
Comilla,Nangalkot,106080,PERIA HIGH SCHOOL,PERIA,PERIA,1712913104,PRIVATE,Yes
Comilla,Nangalkot,106081,DOULKHAR HIGH SCHOOL,DOULKHAR HIGH SCHOOL,DAULKHAR,1732284631,PRIVATE,Yes
Comilla,Nangalkot,106082,MAYURA HIGH SCHOOL,MAJHI PARA,MAYURA,1814232078,PRIVATE,Yes
Comilla,Nangalkot,106084,PANKARA HAFAJA HIGH SCHOOL,PANKARA,CHODIA BAZAR,1819511413,PRIVATE,Yes
Comilla,Nangalkot,106085,NISCHINTAPUR ABDUL GAFOR BHUIYAN HIGH SCHOOL,NISCHINTAPUR,SONDAIL,1911467136,PRIVATE,Yes
Comilla,Nangalkot,106086,CHOWKURI HIGH SCHOOL,CHOWKURI,MANNARA BAZAR,1714436838,PRIVATE,Yes
Comilla,Nangalkot,106087,BEGUM JAMILA MEMURIAL  GIRLS HIGH SCHOOL,NANGOLKOTE MAHINI ROAD,NANGALKOT,1309106087,PRIVATE,Yes
Comilla,Nangalkot,106088,KAKAIRTALA HIGH SCHOOL,KAKAIRTALA,BARO SANGIWSAR ,1817106831,PRIVATE,Yes
Comilla,Nangalkot,106089,BAKSHA GONJ HIGH SCHOOL,KOKALI,HUCAHA MIA,1824558007,PRIVATE,Yes
Comilla,Nangalkot,106090,SHAKTALI HIGH SCHOOL,SHAKTALI,ALIGOANJ BAZAR,1811932778,PRIVATE,Yes
Comilla,Nangalkot,106091,DHALUA HIGH SCHOOL,DAKSHIN BADARPUR,DHALUA ,1711711821,PRIVATE,Yes
Comilla,Nangalkot,106093,DAYEM CHATI HIGH SCHOOL,DAYEM CHATI,DAYEM CHATI BAZAR,1719325894,PRIVATE,Yes
Comilla,Nangalkot,106094,MOKRABPUR HIGH SCHOOL,MOKRABPUR,MOKRABPUR  BAZAR,1766002615,PRIVATE,Yes
Comilla,Nangalkot,106095,HESAKHAL BAZAR HIGH SCHOOL,HESAKHAL,HESAKHAL  BAZAR,1309106095,PRIVATE,Yes
Comilla,Nangalkot,106096,LAKSHMI PADUA RAHAMATIA HIGH SCHOOL,LAKSHMI PADUA,BANGADA BAZAR,1720533056,PRIVATE,Yes
Comilla,Nangalkot,106097,MAHINI HIGH SCHOOL,MAHINI,MAHINI  BAZAR,1819384693,PRIVATE,Yes
Comilla,Nangalkot,106098,SATBARIA HIGH SCHOOL,SATBARIA,SATBARIA BAZAR,1812988122,PRIVATE,Yes
Comilla,Nangalkot,106099,SREEFOLIA HIGH SCHOOL,SREEFOLIA,ASHARKOTA,1309106099,PRIVATE,Yes
Comilla,Nangalkot,106100,JODDA BAZAR PUBLIC HIGH SCHOOL,JODDA,JODDA BAZAR,1816105173,PRIVATE,Yes
Comilla,Nangalkot,106101,BARA SANGISHWAR BALIKA BIDUYANIKATAN,BORO SANGISHWAR,BARA SANGISHWAR,1819169290,PRIVATE,Yes
Comilla,Nangalkot,106102,PUZKARA ADARSHA HIGH SCHOOL,PUZKARA,PUJKARA,1940584232,PRIVATE,Yes
Comilla,Nangalkot,106103,AZIARA HIGH SCHOOL,AZIARA,AZIARA BAZAR,1309106103,PRIVATE,Yes
Comilla,Nangalkot,106104,TULATOLI HIGH SCHOOL,TULATOLI,BELTA,1715412754,PRIVATE,Yes
Comilla,Nangalkot,106105,JHIKATIA ISHAQ MOZUMDER IDEAL GIRLS  H.SCHOOL,MONTALI,MONTALI BAZAR,1819644505,PRIVATE,Yes
Comilla,Nangalkot,106106,CHATITALA HIGH SCHOOL,CHATITALA,GHORAMAYDAN,1309106106,PRIVATE,Yes
Comilla,Nangalkot,106107,CHANDGORA HIGH SCHOOL,CHANDGORA,CHANDGORA,1818714013,PRIVATE,Yes
Comilla,Nangalkot,106108,BAKSHAGONJ GIRLS HIGH SCHOOL,à¦•à§‹à¦•à¦¾à¦²à§€,à¦¹à§à¦šà§à¦›à¦¾ à¦®à¦¿à§Ÿà¦¾,1309106108,PRIVATE,Yes
Comilla,Nangalkot,106109,AL-HAJ SALAMAT ULLAH HIGH SCHOOL,MANNARA,MANNARA BAZAR,1819104689,PRIVATE,Yes
Comilla,Nangalkot,106110,GHORA MAIDAN JUNIOR SECONDARY SCHOOL,GHORA MAIDAN,GHORAMAIDAN,1710767482,PRIVATE,Yes
Comilla,Nangalkot,106111,ISLAM PUR HIGH SCHOOL,BHULUYAPARA,NANGALKOT,1819877213,PRIVATE,Yes
Comilla,Nangalkot,106112,KANDAL IDEAL GIRLS HIGH SCHOOL,KANDAL,TP LAMUA,1726289994,PRIVATE,Yes
Comilla,Nangalkot,106114,GOTROSHAL JUNIOR HIGH SCHOOL,GOTROSHAL,NANGALKOT,1818915496,PRIVATE,Yes
Comilla,Nangalkot,131214,AL-FARUQ ACCADEMY JUNIOR SCHOOL,PURBO DAYARA,NANGALKOT,1715193575,PRIVATE,No
Comilla,Nangalkot,131255,IQRA ACADEMY,PORIKOT,BANGODDA,1813782819,PRIVATE,No
Comilla,Nangalkot,131301,ALHERA HOSIN BIN SALHA ACADAME,SIJIARA,SIJIARA,1710980698,PRIVATE,No
Comilla,Nangalkot,131423,ANOWARA  KABIR ADARSHA JUNIOR HIGH SCHOOL,ASTAGRAM,AG  MIAR BAZAR,1812856873,PRIVATE,Yes
Comilla,Nangalkot,134913,NANGALKOT RESIDENTIAL SCHOOL,PURBA DOUARA,NANGALKOT,1751806005,PRIVATE,No
Comilla,Nangalkot,136731,MOKARA JOBAIDA HAMID JUNIOR SCHOOL,MOKARA,MOKARA,1815323525,PRIVATE,No
Comilla,Nangalkot,137521,RAYKOT GOVT. PRIMARY SCHOOL,RAYKOT,MAHINI BAZAR,1309137521,GOVERNMENT PRIMARY,No
Comilla,Nangalkot,139386,NANGALKOT SHISHU KOLLAYAN JUNIOR SCHOOL,HORIPUR,NANGALKOT,1616738111,PRIVATE,No
Comilla,Titas,105522,UNION TECHNICAL HIGH SCHOOL,KALIR BAZAR/4330,SATANI,1309165414,PRIVATE,Yes
Comilla,Titas,105528,NARANDIA KALIMIAH HIGH SCHOOL,NARANDIA,NARANDIA,1813778656,PRIVATE,Yes
Comilla,Titas,105529,KESHABPUR GIRLS HIGH SCHOOL,KESHABPUR,BATAKANDI,1920766723,PRIVATE,Yes
Comilla,Titas,105532,BATAKANDI SARKAR SHAHEB ALI ABUL HOSSAIN MEMORIAL HIGH SCHOOL,BATAKANDI,BATAKANDI,1818550081,PRIVATE,Yes
Comilla,Titas,105537,JONAB ALI HIGH SCHOOL,DULARAMPUR,ISLAMBAD,1818929492,PRIVATE,Yes
Comilla,Titas,105540,LALPUR NAZRUL ISLAM HIGH SCHOOL,LALPUR,GOURIPUR,1819194618,PRIVATE,Yes
Comilla,Titas,105541,JAGATPUR SADHANA HIGH SCHOOL,JAGATPUR,JAGATPUR,1819137049,PRIVATE,Yes
Comilla,Titas,105543,MACHHIMPUR R. R. INSTITUTION,MACHIMPUR,MACHHIMPUR,1819841639,PRIVATE,Yes
Comilla,Titas,105550,MOZIDPUR HIGH SCHOOL,MOZIDPUR HIGH SCHOOL,MOZIDPUR HIGH SCHOOL,1913127294,PRIVATE,Yes
Comilla,Titas,105555,GOPALPUR DR.MOSHARROF HOSSAIN HIGH SCHOOL,GOPAL PUR,GOPALPUR,1866047707,PRIVATE,Yes
Comilla,Titas,131190,KAPASH KANDI MODEL ACADEMY,KAPASH KANDI,KARIKANDI,1877996807,PRIVATE,No
Comilla,Titas,137010,BEGUM FAZILATUNNESA SCHOOL,RAGHUNATHPUR SATANI,SALIAKANDI,1956604341,PRIVATE,No
Comilla,Titas,137524,ZEARKANDI GOVT. PRIMARY SCHOOL,ZEARKANDI,GOURIPUR,1819111014,GOVERNMENT PRIMARY,No
Comilla,Titas,138425,KATHALIA JUNIOR HIGH SCHOOL,CHAR KUMARIA,1NO SATANI,1817071050,PRIVATE,No